<?xm l version="1.0" encoding="UTF-8"?>

<Enunciado xmlns:xsi="http://www.w3.org/2001/XMLSchema-instance"
    xsi:noNamespaceSchemaLocation="enunciado.xsd">
    <Peso>20</Peso>
    <Titulo> Exercicio 1 </Titulo>
    <Descricao> Some os n√∫meros que lhe sao passados como argumento, e apresente o resultado. </Descricao>
    <Func>Diff</Func>  
    <Linguagens> 
        <Linguagem>C</Linguagem>        
    </Linguagens>
    <Dict>
        <Teste>
            <Nome>Lista vazia</Nome>
            <Input></Input>
            <Output>0</Output>
        </Teste>
        <Teste>
            <Nome>Lista c/ 1 elem</Nome>
            <Input>1</Input>
            <Output>1</Output>
        </Teste>
        <Teste>
            <Nome>Lista c/ varios elem</Nome>
            <Input> 2 3 4 5 </Input>
            <Output>14</Output>
        </Teste>
    </Dict>
        
</Enunciado>